The diagram which from the Calico's offical website:
firefox kube-proxy-cluster-ip.svg

The key reference is the environment: From the environment, we can have a guideline to analysis the logical of calico's clusterip's datapath:
********************************************************************************************************************************************
1.Kubernetes env:
k get nodes -owide 
NAME                        STATUS   ROLES                  AGE   VERSION   INTERNAL-IP   EXTERNAL-IP   OS-IMAGE       KERNEL-VERSION      CONTAINER-RUNTIME
calico-ipip-control-plane   Ready    control-plane,master   98m   v1.23.4   172.18.0.4    <none>        Ubuntu 21.10   5.15.0-56-generic   containerd://1.5.10
calico-ipip-worker          Ready    <none>                 98m   v1.23.4   172.18.0.5    <none>        Ubuntu 21.10   5.15.0-56-generic   containerd://1.5.10
calico-ipip-worker2         Ready    <none>                 98m   v1.23.4   172.18.0.3    <none>        Ubuntu 21.10   5.15.0-56-generic   containerd://1.5.10


2.Pods and Service env:
k get pods -owide 
NAME         READY   STATUS    RESTARTS   AGE   IP              NODE                        NOMINATED NODE   READINESS GATES
wluo-6pdtj   1/1     Running   0          96m   10.244.79.1     calico-ipip-worker          <none>           <none>
wluo-msw47   1/1     Running   0          96m   10.244.51.197   calico-ipip-control-plane   <none>           <none>
wluo-wcrjw   1/1     Running   0          96m   10.244.244.65   calico-ipip-worker2         <none>           <none>

kubectl get svc -owide | grep wluo
wluo         NodePort    10.96.131.59   <none>        8080:32000/TCP   99m    app=wluo


3.Test clusterip and capture the datapath:
$ curl at calico-ipip-control-plane Node to Pod wluo-6pdtj:
$ wireshark ./Node-calico-ipip-control-plane.cap
3.1:Capture at calico-ipip-control-plane:[we can follow the TCP three ways handshake to anlysis!!!]
129	2022-12-12 18:41:03.185848	10.244.51.192	10.244.79.1	TCP	94	02:42:ac:12:00:04	02:42:ac:12:00:05		13	5705 → 80 [SYN] Seq=0 Win=64240 Len=0 MSS=1460 SACK_PERM=1 TSval=1362992548 TSecr=0 WS=128
130	2022-12-12 18:41:03.185929	10.244.79.1	10.244.51.192	TCP	94	02:42:ac:12:00:05	02:42:ac:12:00:04		13	80 → 5705 [SYN, ACK] Seq=0 Ack=1 Win=64260 Len=0 MSS=1440 SACK_PERM=1 TSval=3887962308 TSecr=1362992548 WS=128
131	2022-12-12 18:41:03.185949	10.244.51.192	10.244.79.1	TCP	86	02:42:ac:12:00:04	02:42:ac:12:00:05		13	5705 → 80 [ACK] Seq=1 Ack=1 Win=64256 Len=0 TSval=1362992548 TSecr=3887962308
132	2022-12-12 18:41:03.186015	10.244.51.192	10.244.79.1	HTTP	167	02:42:ac:12:00:04	02:42:ac:12:00:05		13	GET / HTTP/1.1 
133	2022-12-12 18:41:03.186034	10.244.79.1	10.244.51.192	TCP	86	02:42:ac:12:00:05	02:42:ac:12:00:04		13	80 → 5705 [ACK] Seq=1 Ack=82 Win=64256 Len=0 TSval=3887962308 TSecr=1362992548
134	2022-12-12 18:41:03.186198	10.244.79.1	10.244.51.192	TCP	322	02:42:ac:12:00:05	02:42:ac:12:00:04		13	80 → 5705 [PSH, ACK] Seq=1 Ack=82 Win=64256 Len=236 TSval=3887962308 TSecr=1362992548 [TCP segment of a reassembled PDU]
135	2022-12-12 18:41:03.186227	10.244.51.192	10.244.79.1	TCP	86	02:42:ac:12:00:04	02:42:ac:12:00:05		13	5705 → 80 [ACK] Seq=82 Ack=237 Win=64128 Len=0 TSval=1362992549 TSecr=3887962308
136	2022-12-12 18:41:03.186281	10.244.79.1	10.244.51.192	HTTP	166	02:42:ac:12:00:05	02:42:ac:12:00:04		13	HTTP/1.1 200 OK  (text/html)
137	2022-12-12 18:41:03.186291	10.244.51.192	10.244.79.1	TCP	86	02:42:ac:12:00:04	02:42:ac:12:00:05		13	5705 → 80 [ACK] Seq=82 Ack=317 Win=64128 Len=0 TSval=1362992549 TSecr=3887962309
138	2022-12-12 18:41:03.186381	10.244.51.192	10.244.79.1	TCP	86	02:42:ac:12:00:04	02:42:ac:12:00:05		13	5705 → 80 [FIN, ACK] Seq=82 Ack=317 Win=64128 Len=0 TSval=1362992549 TSecr=3887962309
139	2022-12-12 18:41:03.186483	10.244.79.1	10.244.51.192	TCP	86	02:42:ac:12:00:05	02:42:ac:12:00:04		13	80 → 5705 [FIN, ACK] Seq=317 Ack=83 Win=64256 Len=0 TSval=3887962309 TSecr=1362992549
140	2022-12-12 18:41:03.186503	10.244.51.192	10.244.79.1	TCP	86	02:42:ac:12:00:04	02:42:ac:12:00:05		13	5705 → 80 [ACK] Seq=83 Ack=318 Win=64128 Len=0 TSval=1362992549 TSecr=3887962309


3.2:Capture at calico-ipip-worker:
$ wireshark ./Node-calico-ipip-worker-Pod-wluo-6pdtj.cap
2	2022-12-12 18:41:03.185866	10.244.51.192	10.244.79.1	TCP	94	02:42:ac:12:00:04	02:42:ac:12:00:05		0	5705 → 80 [SYN] Seq=0 Win=64240 Len=0 MSS=1460 SACK_PERM=1 TSval=1362992548 TSecr=0 WS=128
3	2022-12-12 18:41:03.185925	10.244.79.1	10.244.51.192	TCP	94	02:42:ac:12:00:05	02:42:ac:12:00:04		0	80 → 5705 [SYN, ACK] Seq=0 Ack=1 Win=64260 Len=0 MSS=1440 SACK_PERM=1 TSval=3887962308 TSecr=1362992548 WS=128
4	2022-12-12 18:41:03.185951	10.244.51.192	10.244.79.1	TCP	86	02:42:ac:12:00:04	02:42:ac:12:00:05		0	5705 → 80 [ACK] Seq=1 Ack=1 Win=64256 Len=0 TSval=1362992548 TSecr=3887962308
5	2022-12-12 18:41:03.186018	10.244.51.192	10.244.79.1	HTTP	167	02:42:ac:12:00:04	02:42:ac:12:00:05		0	GET / HTTP/1.1 
6	2022-12-12 18:41:03.186032	10.244.79.1	10.244.51.192	TCP	86	02:42:ac:12:00:05	02:42:ac:12:00:04		0	80 → 5705 [ACK] Seq=1 Ack=82 Win=64256 Len=0 TSval=3887962308 TSecr=1362992548
7	2022-12-12 18:41:03.186185	10.244.79.1	10.244.51.192	TCP	322	02:42:ac:12:00:05	02:42:ac:12:00:04		0	80 → 5705 [PSH, ACK] Seq=1 Ack=82 Win=64256 Len=236 TSval=3887962308 TSecr=1362992548 [TCP segment of a reassembled PDU]
8	2022-12-12 18:41:03.186250	10.244.51.192	10.244.79.1	TCP	86	02:42:ac:12:00:04	02:42:ac:12:00:05		0	5705 → 80 [ACK] Seq=82 Ack=237 Win=64128 Len=0 TSval=1362992549 TSecr=3887962308
9	2022-12-12 18:41:03.186279	10.244.79.1	10.244.51.192	HTTP	166	02:42:ac:12:00:05	02:42:ac:12:00:04		0	HTTP/1.1 200 OK  (text/html)
10	2022-12-12 18:41:03.186293	10.244.51.192	10.244.79.1	TCP	86	02:42:ac:12:00:04	02:42:ac:12:00:05		0	5705 → 80 [ACK] Seq=82 Ack=317 Win=64128 Len=0 TSval=1362992549 TSecr=3887962309
11	2022-12-12 18:41:03.186386	10.244.51.192	10.244.79.1	TCP	86	02:42:ac:12:00:04	02:42:ac:12:00:05		0	5705 → 80 [FIN, ACK] Seq=82 Ack=317 Win=64128 Len=0 TSval=1362992549 TSecr=3887962309
12	2022-12-12 18:41:03.186477	10.244.79.1	10.244.51.192	TCP	86	02:42:ac:12:00:05	02:42:ac:12:00:04		0	80 → 5705 [FIN, ACK] Seq=317 Ack=83 Win=64256 Len=0 TSval=3887962309 TSecr=1362992549
13	2022-12-12 18:41:03.186515	10.244.51.192	10.244.79.1	TCP	86	02:42:ac:12:00:04	02:42:ac:12:00:05		0	5705 → 80 [ACK] Seq=83 Ack=318 Win=64128 Len=0 TSval=1362992549 TSecr=3887962309

