The diagram which from the Calico's offical website:
firefox kube-proxy-node-port.svg 

The key reference is the environment: From the environment, we can have a guideline to analysis the logical of calico's nodeport's datapath:
********************************************************************************************************************************************
1.Kubernetes env:
k get nodes -owide 
NAME                        STATUS   ROLES                  AGE   VERSION   INTERNAL-IP   EXTERNAL-IP   OS-IMAGE       KERNEL-VERSION      CONTAINER-RUNTIME
calico-ipip-control-plane   Ready    control-plane,master   98m   v1.23.4   172.18.0.4    <none>        Ubuntu 21.10   5.15.0-56-generic   containerd://1.5.10
calico-ipip-worker          Ready    <none>                 98m   v1.23.4   172.18.0.5    <none>        Ubuntu 21.10   5.15.0-56-generic   containerd://1.5.10
calico-ipip-worker2         Ready    <none>                 98m   v1.23.4   172.18.0.3    <none>        Ubuntu 21.10   5.15.0-56-generic   containerd://1.5.10


2.Pods and Service env:
k get pods -owide 
NAME         READY   STATUS    RESTARTS   AGE   IP              NODE                        NOMINATED NODE   READINESS GATES
wluo-6pdtj   1/1     Running   0          96m   10.244.79.1     calico-ipip-worker          <none>           <none>
wluo-msw47   1/1     Running   0          96m   10.244.51.197   calico-ipip-control-plane   <none>           <none>
wluo-wcrjw   1/1     Running   0          96m   10.244.244.65   calico-ipip-worker2         <none>           <none>

kubectl get svc -owide | grep wluo
wluo         NodePort    10.96.131.59   <none>        8080:32000/TCP   99m    app=wluo


3.Test nodePort and capture the datapath:
$ curl at wluo host(local host(172.18.0.1)) Node to Pod wluo-6pdtj:{Please note the tcp stream id to filter the pcap to understand the logical:}
$ curl 172.18.0.4:32000
wirehsark Node-calico-ipip-control-plane-nodeport.cap
42	2022-12-12 18:46:30.596115	172.18.0.1	172.18.0.4	TCP	74	02:42:0e:0f:cd:34	02:42:ac:12:00:04		3	51814 → 32000 [SYN] Seq=0 Win=64240 Len=0 MSS=1460 SACK_PERM=1 TSval=2083905142 TSecr=0 WS=128
43	2022-12-12 18:46:30.596166	10.244.51.192	10.244.79.1	TCP	94	02:42:ac:12:00:04	02:42:ac:12:00:05		4	30102 → 80 [SYN] Seq=0 Win=64240 Len=0 MSS=1460 SACK_PERM=1 TSval=2083905142 TSecr=0 WS=128
44	2022-12-12 18:46:30.596239	10.244.79.1	10.244.51.192	TCP	94	02:42:ac:12:00:05	02:42:ac:12:00:04		4	80 → 30102 [SYN, ACK] Seq=0 Ack=1 Win=64260 Len=0 MSS=1440 SACK_PERM=1 TSval=3888289719 TSecr=2083905142 WS=128
45	2022-12-12 18:46:30.596245	172.18.0.4	172.18.0.1	TCP	74	02:42:ac:12:00:04	02:42:0e:0f:cd:34		3	32000 → 51814 [SYN, ACK] Seq=0 Ack=1 Win=64260 Len=0 MSS=1440 SACK_PERM=1 TSval=3888289719 TSecr=2083905142 WS=128
46	2022-12-12 18:46:30.596258	172.18.0.1	172.18.0.4	TCP	66	02:42:0e:0f:cd:34	02:42:ac:12:00:04		3	51814 → 32000 [ACK] Seq=1 Ack=1 Win=64256 Len=0 TSval=2083905143 TSecr=3888289719
47	2022-12-12 18:46:30.596263	10.244.51.192	10.244.79.1	TCP	86	02:42:ac:12:00:04	02:42:ac:12:00:05		4	30102 → 80 [ACK] Seq=1 Ack=1 Win=64256 Len=0 TSval=2083905143 TSecr=3888289719
48	2022-12-12 18:46:30.596325	172.18.0.1	172.18.0.4	HTTP	146	02:42:0e:0f:cd:34	02:42:ac:12:00:04		3	GET / HTTP/1.1 
49	2022-12-12 18:46:30.596333	10.244.51.192	10.244.79.1	HTTP	166	02:42:ac:12:00:04	02:42:ac:12:00:05		4	GET / HTTP/1.1 
50	2022-12-12 18:46:30.596350	10.244.79.1	10.244.51.192	TCP	86	02:42:ac:12:00:05	02:42:ac:12:00:04		4	80 → 30102 [ACK] Seq=1 Ack=81 Win=64256 Len=0 TSval=3888289719 TSecr=2083905143
51	2022-12-12 18:46:30.596354	172.18.0.4	172.18.0.1	TCP	66	02:42:ac:12:00:04	02:42:0e:0f:cd:34		3	32000 → 51814 [ACK] Seq=1 Ack=81 Win=64256 Len=0 TSval=3888289719 TSecr=2083905143
52	2022-12-12 18:46:30.596493	10.244.79.1	10.244.51.192	TCP	322	02:42:ac:12:00:05	02:42:ac:12:00:04		4	80 → 30102 [PSH, ACK] Seq=1 Ack=81 Win=64256 Len=236 TSval=3888289719 TSecr=2083905143 [TCP segment of a reassembled PDU]
53	2022-12-12 18:46:30.596502	172.18.0.4	172.18.0.1	TCP	302	02:42:ac:12:00:04	02:42:0e:0f:cd:34		3	32000 → 51814 [PSH, ACK] Seq=1 Ack=81 Win=64256 Len=236 TSval=3888289719 TSecr=2083905143 [TCP segment of a reassembled PDU]
54	2022-12-12 18:46:30.596530	172.18.0.1	172.18.0.4	TCP	66	02:42:0e:0f:cd:34	02:42:ac:12:00:04		3	51814 → 32000 [ACK] Seq=81 Ack=237 Win=64128 Len=0 TSval=2083905143 TSecr=3888289719
55	2022-12-12 18:46:30.596539	10.244.51.192	10.244.79.1	TCP	86	02:42:ac:12:00:04	02:42:ac:12:00:05		4	30102 → 80 [ACK] Seq=81 Ack=237 Win=64128 Len=0 TSval=2083905143 TSecr=3888289719
56	2022-12-12 18:46:30.596570	10.244.79.1	10.244.51.192	HTTP	166	02:42:ac:12:00:05	02:42:ac:12:00:04		4	HTTP/1.1 200 OK  (text/html)
57	2022-12-12 18:46:30.596574	172.18.0.4	172.18.0.1	HTTP	146	02:42:ac:12:00:04	02:42:0e:0f:cd:34		3	HTTP/1.1 200 OK  (text/html)
58	2022-12-12 18:46:30.596578	172.18.0.1	172.18.0.4	TCP	66	02:42:0e:0f:cd:34	02:42:ac:12:00:04		3	51814 → 32000 [ACK] Seq=81 Ack=317 Win=64128 Len=0 TSval=2083905143 TSecr=3888289719
59	2022-12-12 18:46:30.596582	10.244.51.192	10.244.79.1	TCP	86	02:42:ac:12:00:04	02:42:ac:12:00:05		4	30102 → 80 [ACK] Seq=81 Ack=317 Win=64128 Len=0 TSval=2083905143 TSecr=3888289719
60	2022-12-12 18:46:30.596691	172.18.0.1	172.18.0.4	TCP	66	02:42:0e:0f:cd:34	02:42:ac:12:00:04		3	51814 → 32000 [FIN, ACK] Seq=81 Ack=317 Win=64128 Len=0 TSval=2083905143 TSecr=3888289719
61	2022-12-12 18:46:30.596704	10.244.51.192	10.244.79.1	TCP	86	02:42:ac:12:00:04	02:42:ac:12:00:05		4	30102 → 80 [FIN, ACK] Seq=81 Ack=317 Win=64128 Len=0 TSval=2083905143 TSecr=3888289719
62	2022-12-12 18:46:30.596865	10.244.79.1	10.244.51.192	TCP	86	02:42:ac:12:00:05	02:42:ac:12:00:04		4	80 → 30102 [FIN, ACK] Seq=317 Ack=82 Win=64256 Len=0 TSval=3888289719 TSecr=2083905143
63	2022-12-12 18:46:30.596885	172.18.0.4	172.18.0.1	TCP	66	02:42:ac:12:00:04	02:42:0e:0f:cd:34		3	32000 → 51814 [FIN, ACK] Seq=317 Ack=82 Win=64256 Len=0 TSval=3888289719 TSecr=2083905143
64	2022-12-12 18:46:30.596904	172.18.0.1	172.18.0.4	TCP	66	02:42:0e:0f:cd:34	02:42:ac:12:00:04		3	51814 → 32000 [ACK] Seq=82 Ack=318 Win=64128 Len=0 TSval=2083905143 TSecr=3888289719
65	2022-12-12 18:46:30.596914	10.244.51.192	10.244.79.1	TCP	86	02:42:ac:12:00:04	02:42:ac:12:00:05		4	30102 → 80 [ACK] Seq=82 Ack=318 Win=64128 Len=0 TSval=2083905143 TSecr=3888289719


3.2:Capture at calico-ipip-worker:
wireshark Node-calico-ipip-worker-Pod-wluo-6pdtj-nodeport.cap
1	2022-12-12 18:46:30.596177	10.244.51.192	10.244.79.1	TCP	94	02:42:ac:12:00:04	02:42:ac:12:00:05		0	30102 → 80 [SYN] Seq=0 Win=64240 Len=0 MSS=1460 SACK_PERM=1 TSval=2083905142 TSecr=0 WS=128
2	2022-12-12 18:46:30.596236	10.244.79.1	10.244.51.192	TCP	94	02:42:ac:12:00:05	02:42:ac:12:00:04		0	80 → 30102 [SYN, ACK] Seq=0 Ack=1 Win=64260 Len=0 MSS=1440 SACK_PERM=1 TSval=3888289719 TSecr=2083905142 WS=128
3	2022-12-12 18:46:30.596264	10.244.51.192	10.244.79.1	TCP	86	02:42:ac:12:00:04	02:42:ac:12:00:05		0	30102 → 80 [ACK] Seq=1 Ack=1 Win=64256 Len=0 TSval=2083905143 TSecr=3888289719
4	2022-12-12 18:46:30.596336	10.244.51.192	10.244.79.1	HTTP	166	02:42:ac:12:00:04	02:42:ac:12:00:05		0	GET / HTTP/1.1 
5	2022-12-12 18:46:30.596348	10.244.79.1	10.244.51.192	TCP	86	02:42:ac:12:00:05	02:42:ac:12:00:04		0	80 → 30102 [ACK] Seq=1 Ack=81 Win=64256 Len=0 TSval=3888289719 TSecr=2083905143
6	2022-12-12 18:46:30.596486	10.244.79.1	10.244.51.192	TCP	322	02:42:ac:12:00:05	02:42:ac:12:00:04		0	80 → 30102 [PSH, ACK] Seq=1 Ack=81 Win=64256 Len=236 TSval=3888289719 TSecr=2083905143 [TCP segment of a reassembled PDU]
7	2022-12-12 18:46:30.596542	10.244.51.192	10.244.79.1	TCP	86	02:42:ac:12:00:04	02:42:ac:12:00:05		0	30102 → 80 [ACK] Seq=81 Ack=237 Win=64128 Len=0 TSval=2083905143 TSecr=3888289719
8	2022-12-12 18:46:30.596568	10.244.79.1	10.244.51.192	HTTP	166	02:42:ac:12:00:05	02:42:ac:12:00:04		0	HTTP/1.1 200 OK  (text/html)
9	2022-12-12 18:46:30.596584	10.244.51.192	10.244.79.1	TCP	86	02:42:ac:12:00:04	02:42:ac:12:00:05		0	30102 → 80 [ACK] Seq=81 Ack=317 Win=64128 Len=0 TSval=2083905143 TSecr=3888289719
10	2022-12-12 18:46:30.596709	10.244.51.192	10.244.79.1	TCP	86	02:42:ac:12:00:04	02:42:ac:12:00:05		0	30102 → 80 [FIN, ACK] Seq=81 Ack=317 Win=64128 Len=0 TSval=2083905143 TSecr=3888289719
11	2022-12-12 18:46:30.596849	10.244.79.1	10.244.51.192	TCP	86	02:42:ac:12:00:05	02:42:ac:12:00:04		0	80 → 30102 [FIN, ACK] Seq=317 Ack=82 Win=64256 Len=0 TSval=3888289719 TSecr=2083905143
12	2022-12-12 18:46:30.596917	10.244.51.192	10.244.79.1	TCP	86	02:42:ac:12:00:04	02:42:ac:12:00:05		0	30102 → 80 [ACK] Seq=82 Ack=318 Win=64128 Len=0 TSval=2083905143 TSecr=3888289719

