No.     Time                          Source                Destination           Protocol Length Destination Port Stream index Destination Port Info
      1 2023-05-24 08:22:03.389914    172.18.0.4            10.244.204.3          TCP      74     80               0                             59636 → 80 [SYN] Seq=0 Win=64240 Len=0 MSS=1460 SACK_PERM=1 TSval=2528153792 TSecr=0 WS=128

Frame 1: 74 bytes on wire (592 bits), 74 bytes captured (592 bits)
    Encapsulation type: Ethernet (1)
    Arrival Time: May 24, 2023 08:22:03.389914000 China Standard Time
    [Time shift for this packet: 0.000000000 seconds]
    Epoch Time: 1684887723.389914000 seconds
    [Time delta from previous captured frame: 0.000000000 seconds]
    [Time delta from previous displayed frame: 0.000000000 seconds]
    [Time since reference or first frame: 0.000000000 seconds]
    Frame Number: 1
    Frame Length: 74 bytes (592 bits)
    Capture Length: 74 bytes (592 bits)
    [Frame is marked: False]
    [Frame is ignored: False]
    [Protocols in frame: eth:ethertype:ip:tcp]
    [Coloring Rule Name: HTTP]
    [Coloring Rule String: http || tcp.port == 80 || http2]
Ethernet II, Src: ee:ee:ee:ee:ee:ee (ee:ee:ee:ee:ee:ee), Dst: e6:28:50:d4:d0:25 (e6:28:50:d4:d0:25)
    Destination: e6:28:50:d4:d0:25 (e6:28:50:d4:d0:25)
        Address: e6:28:50:d4:d0:25 (e6:28:50:d4:d0:25)
        .... ..1. .... .... .... .... = LG bit: Locally administered address (this is NOT the factory default)
        .... ...0 .... .... .... .... = IG bit: Individual address (unicast)
    Source: ee:ee:ee:ee:ee:ee (ee:ee:ee:ee:ee:ee)
        Address: ee:ee:ee:ee:ee:ee (ee:ee:ee:ee:ee:ee)
        .... ..1. .... .... .... .... = LG bit: Locally administered address (this is NOT the factory default)
        .... ...0 .... .... .... .... = IG bit: Individual address (unicast)
    Type: IPv4 (0x0800)
Internet Protocol Version 4, Src: 172.18.0.4, Dst: 10.244.204.3
    0100 .... = Version: 4
    .... 0101 = Header Length: 20 bytes (5)
    Differentiated Services Field: 0x00 (DSCP: CS0, ECN: Not-ECT)
        0000 00.. = Differentiated Services Codepoint: Default (0)
        .... ..00 = Explicit Congestion Notification: Not ECN-Capable Transport (0)
    Total Length: 60
    Identification: 0xdc88 (56456)
    Flags: 0x40, Don't fragment
        0... .... = Reserved bit: Not set
        .1.. .... = Don't fragment: Set
        ..0. .... = More fragments: Not set
    ...0 0000 0000 0000 = Fragment Offset: 0
    Time to Live: 63
    Protocol: TCP (6)
    Header Checksum: 0xdc25 [validation disabled]
    [Header checksum status: Unverified]
    Source Address: 172.18.0.4
    Destination Address: 10.244.204.3
Transmission Control Protocol, Src Port: 59636, Dst Port: 80, Seq: 0, Len: 0
    Source Port: 59636
    Destination Port: 80
    [Stream index: 0]
    [Conversation completeness: Complete, WITH_DATA (31)]
    [TCP Segment Len: 0]
    Sequence Number: 0    (relative sequence number)
    Sequence Number (raw): 257479740
    [Next Sequence Number: 1    (relative sequence number)]
    Acknowledgment Number: 0
    Acknowledgment number (raw): 0
    1010 .... = Header Length: 40 bytes (10)
    Flags: 0x002 (SYN)
        000. .... .... = Reserved: Not set
        ...0 .... .... = Nonce: Not set
        .... 0... .... = Congestion Window Reduced (CWR): Not set
        .... .0.. .... = ECN-Echo: Not set
        .... ..0. .... = Urgent: Not set
        .... ...0 .... = Acknowledgment: Not set
        .... .... 0... = Push: Not set
        .... .... .0.. = Reset: Not set
        .... .... ..1. = Syn: Set
            [Expert Info (Chat/Sequence): Connection establish request (SYN): server port 80]
                [Connection establish request (SYN): server port 80]
                [Severity level: Chat]
                [Group: Sequence]
        .... .... ...0 = Fin: Not set
        [TCP Flags: ··········S·]
    Window: 64240
    [Calculated window size: 64240]
    Checksum: 0x833c [unverified]
    [Checksum Status: Unverified]
    Urgent Pointer: 0
    Options: (20 bytes), Maximum segment size, SACK permitted, Timestamps, No-Operation (NOP), Window scale
        TCP Option - Maximum segment size: 1460 bytes
            Kind: Maximum Segment Size (2)
            Length: 4
            MSS Value: 1460
        TCP Option - SACK permitted
            Kind: SACK Permitted (4)
            Length: 2
        TCP Option - Timestamps: TSval 2528153792, TSecr 0
            Kind: Time Stamp Option (8)
            Length: 10
            Timestamp value: 2528153792
            Timestamp echo reply: 0
        TCP Option - No-Operation (NOP)
            Kind: No-Operation (1)
        TCP Option - Window scale: 7 (multiply by 128)
            Kind: Window Scale (3)
            Length: 3
            Shift count: 7
            [Multiplier: 128]
    [Timestamps]
        [Time since first frame in this TCP stream: 0.000000000 seconds]
        [Time since previous frame in this TCP stream: 0.000000000 seconds]

No.     Time                          Source                Destination           Protocol Length Destination Port Stream index Destination Port Info
      2 2023-05-24 08:22:03.389933    10.244.204.3          172.18.0.4            TCP      74     59636            0                             80 → 59636 [SYN, ACK] Seq=0 Ack=1 Win=64308 Len=0 MSS=1410 SACK_PERM=1 TSval=2685176034 TSecr=2528153792 WS=128

Frame 2: 74 bytes on wire (592 bits), 74 bytes captured (592 bits)
    Encapsulation type: Ethernet (1)
    Arrival Time: May 24, 2023 08:22:03.389933000 China Standard Time
    [Time shift for this packet: 0.000000000 seconds]
    Epoch Time: 1684887723.389933000 seconds
    [Time delta from previous captured frame: 0.000019000 seconds]
    [Time delta from previous displayed frame: 0.000019000 seconds]
    [Time since reference or first frame: 0.000019000 seconds]
    Frame Number: 2
    Frame Length: 74 bytes (592 bits)
    Capture Length: 74 bytes (592 bits)
    [Frame is marked: False]
    [Frame is ignored: False]
    [Protocols in frame: eth:ethertype:ip:tcp]
    [Coloring Rule Name: HTTP]
    [Coloring Rule String: http || tcp.port == 80 || http2]
Ethernet II, Src: e6:28:50:d4:d0:25 (e6:28:50:d4:d0:25), Dst: ee:ee:ee:ee:ee:ee (ee:ee:ee:ee:ee:ee)
    Destination: ee:ee:ee:ee:ee:ee (ee:ee:ee:ee:ee:ee)
        Address: ee:ee:ee:ee:ee:ee (ee:ee:ee:ee:ee:ee)
        .... ..1. .... .... .... .... = LG bit: Locally administered address (this is NOT the factory default)
        .... ...0 .... .... .... .... = IG bit: Individual address (unicast)
    Source: e6:28:50:d4:d0:25 (e6:28:50:d4:d0:25)
        Address: e6:28:50:d4:d0:25 (e6:28:50:d4:d0:25)
        .... ..1. .... .... .... .... = LG bit: Locally administered address (this is NOT the factory default)
        .... ...0 .... .... .... .... = IG bit: Individual address (unicast)
    Type: IPv4 (0x0800)
Internet Protocol Version 4, Src: 10.244.204.3, Dst: 172.18.0.4
    0100 .... = Version: 4
    .... 0101 = Header Length: 20 bytes (5)
    Differentiated Services Field: 0x00 (DSCP: CS0, ECN: Not-ECT)
        0000 00.. = Differentiated Services Codepoint: Default (0)
        .... ..00 = Explicit Congestion Notification: Not ECN-Capable Transport (0)
    Total Length: 60
    Identification: 0x0000 (0)
    Flags: 0x40, Don't fragment
        0... .... = Reserved bit: Not set
        .1.. .... = Don't fragment: Set
        ..0. .... = More fragments: Not set
    ...0 0000 0000 0000 = Fragment Offset: 0
    Time to Live: 64
    Protocol: TCP (6)
    Header Checksum: 0xb7ae [validation disabled]
    [Header checksum status: Unverified]
    Source Address: 10.244.204.3
    Destination Address: 172.18.0.4
Transmission Control Protocol, Src Port: 80, Dst Port: 59636, Seq: 0, Ack: 1, Len: 0
    Source Port: 80
    Destination Port: 59636
    [Stream index: 0]
    [Conversation completeness: Complete, WITH_DATA (31)]
    [TCP Segment Len: 0]
    Sequence Number: 0    (relative sequence number)
    Sequence Number (raw): 967943451
    [Next Sequence Number: 1    (relative sequence number)]
    Acknowledgment Number: 1    (relative ack number)
    Acknowledgment number (raw): 257479741
    1010 .... = Header Length: 40 bytes (10)
    Flags: 0x012 (SYN, ACK)
        000. .... .... = Reserved: Not set
        ...0 .... .... = Nonce: Not set
        .... 0... .... = Congestion Window Reduced (CWR): Not set
        .... .0.. .... = ECN-Echo: Not set
        .... ..0. .... = Urgent: Not set
        .... ...1 .... = Acknowledgment: Set
        .... .... 0... = Push: Not set
        .... .... .0.. = Reset: Not set
        .... .... ..1. = Syn: Set
            [Expert Info (Chat/Sequence): Connection establish acknowledge (SYN+ACK): server port 80]
                [Connection establish acknowledge (SYN+ACK): server port 80]
                [Severity level: Chat]
                [Group: Sequence]
        .... .... ...0 = Fin: Not set
        [TCP Flags: ·······A··S·]
    Window: 64308
    [Calculated window size: 64308]
    Checksum: 0x833c [unverified]
    [Checksum Status: Unverified]
    Urgent Pointer: 0
    Options: (20 bytes), Maximum segment size, SACK permitted, Timestamps, No-Operation (NOP), Window scale
        TCP Option - Maximum segment size: 1410 bytes
            Kind: Maximum Segment Size (2)
            Length: 4
            MSS Value: 1410
        TCP Option - SACK permitted
            Kind: SACK Permitted (4)
            Length: 2
        TCP Option - Timestamps: TSval 2685176034, TSecr 2528153792
            Kind: Time Stamp Option (8)
            Length: 10
            Timestamp value: 2685176034
            Timestamp echo reply: 2528153792
        TCP Option - No-Operation (NOP)
            Kind: No-Operation (1)
        TCP Option - Window scale: 7 (multiply by 128)
            Kind: Window Scale (3)
            Length: 3
            Shift count: 7
            [Multiplier: 128]
    [Timestamps]
        [Time since first frame in this TCP stream: 0.000019000 seconds]
        [Time since previous frame in this TCP stream: 0.000019000 seconds]
    [SEQ/ACK analysis]
        [This is an ACK to the segment in frame: 1]
        [The RTT to ACK the segment was: 0.000019000 seconds]
        [iRTT: 0.000048000 seconds]

No.     Time                          Source                Destination           Protocol Length Destination Port Stream index Destination Port Info
      3 2023-05-24 08:22:03.389962    172.18.0.4            10.244.204.3          TCP      66     80               0                             59636 → 80 [ACK] Seq=1 Ack=1 Win=64256 Len=0 TSval=2528153793 TSecr=2685176034

Frame 3: 66 bytes on wire (528 bits), 66 bytes captured (528 bits)
    Encapsulation type: Ethernet (1)
    Arrival Time: May 24, 2023 08:22:03.389962000 China Standard Time
    [Time shift for this packet: 0.000000000 seconds]
    Epoch Time: 1684887723.389962000 seconds
    [Time delta from previous captured frame: 0.000029000 seconds]
    [Time delta from previous displayed frame: 0.000029000 seconds]
    [Time since reference or first frame: 0.000048000 seconds]
    Frame Number: 3
    Frame Length: 66 bytes (528 bits)
    Capture Length: 66 bytes (528 bits)
    [Frame is marked: False]
    [Frame is ignored: False]
    [Protocols in frame: eth:ethertype:ip:tcp]
    [Coloring Rule Name: HTTP]
    [Coloring Rule String: http || tcp.port == 80 || http2]
Ethernet II, Src: ee:ee:ee:ee:ee:ee (ee:ee:ee:ee:ee:ee), Dst: e6:28:50:d4:d0:25 (e6:28:50:d4:d0:25)
    Destination: e6:28:50:d4:d0:25 (e6:28:50:d4:d0:25)
        Address: e6:28:50:d4:d0:25 (e6:28:50:d4:d0:25)
        .... ..1. .... .... .... .... = LG bit: Locally administered address (this is NOT the factory default)
        .... ...0 .... .... .... .... = IG bit: Individual address (unicast)
    Source: ee:ee:ee:ee:ee:ee (ee:ee:ee:ee:ee:ee)
        Address: ee:ee:ee:ee:ee:ee (ee:ee:ee:ee:ee:ee)
        .... ..1. .... .... .... .... = LG bit: Locally administered address (this is NOT the factory default)
        .... ...0 .... .... .... .... = IG bit: Individual address (unicast)
    Type: IPv4 (0x0800)
Internet Protocol Version 4, Src: 172.18.0.4, Dst: 10.244.204.3
    0100 .... = Version: 4
    .... 0101 = Header Length: 20 bytes (5)
    Differentiated Services Field: 0x00 (DSCP: CS0, ECN: Not-ECT)
        0000 00.. = Differentiated Services Codepoint: Default (0)
        .... ..00 = Explicit Congestion Notification: Not ECN-Capable Transport (0)
    Total Length: 52
    Identification: 0xdc89 (56457)
    Flags: 0x40, Don't fragment
        0... .... = Reserved bit: Not set
        .1.. .... = Don't fragment: Set
        ..0. .... = More fragments: Not set
    ...0 0000 0000 0000 = Fragment Offset: 0
    Time to Live: 63
    Protocol: TCP (6)
    Header Checksum: 0xdc2c [validation disabled]
    [Header checksum status: Unverified]
    Source Address: 172.18.0.4
    Destination Address: 10.244.204.3
Transmission Control Protocol, Src Port: 59636, Dst Port: 80, Seq: 1, Ack: 1, Len: 0
    Source Port: 59636
    Destination Port: 80
    [Stream index: 0]
    [Conversation completeness: Complete, WITH_DATA (31)]
    [TCP Segment Len: 0]
    Sequence Number: 1    (relative sequence number)
    Sequence Number (raw): 257479741
    [Next Sequence Number: 1    (relative sequence number)]
    Acknowledgment Number: 1    (relative ack number)
    Acknowledgment number (raw): 967943452
    1000 .... = Header Length: 32 bytes (8)
    Flags: 0x010 (ACK)
        000. .... .... = Reserved: Not set
        ...0 .... .... = Nonce: Not set
        .... 0... .... = Congestion Window Reduced (CWR): Not set
        .... .0.. .... = ECN-Echo: Not set
        .... ..0. .... = Urgent: Not set
        .... ...1 .... = Acknowledgment: Set
        .... .... 0... = Push: Not set
        .... .... .0.. = Reset: Not set
        .... .... ..0. = Syn: Not set
        .... .... ...0 = Fin: Not set
        [TCP Flags: ·······A····]
    Window: 502
    [Calculated window size: 64256]
    [Window size scaling factor: 128]
    Checksum: 0x8334 [unverified]
    [Checksum Status: Unverified]
    Urgent Pointer: 0
    Options: (12 bytes), No-Operation (NOP), No-Operation (NOP), Timestamps
        TCP Option - No-Operation (NOP)
            Kind: No-Operation (1)
        TCP Option - No-Operation (NOP)
            Kind: No-Operation (1)
        TCP Option - Timestamps: TSval 2528153793, TSecr 2685176034
            Kind: Time Stamp Option (8)
            Length: 10
            Timestamp value: 2528153793
            Timestamp echo reply: 2685176034
    [Timestamps]
        [Time since first frame in this TCP stream: 0.000048000 seconds]
        [Time since previous frame in this TCP stream: 0.000029000 seconds]
    [SEQ/ACK analysis]
        [This is an ACK to the segment in frame: 2]
        [The RTT to ACK the segment was: 0.000029000 seconds]
        [iRTT: 0.000048000 seconds]

No.     Time                          Source                Destination           Protocol Length Destination Port Stream index Destination Port Info
      4 2023-05-24 08:22:03.390019    172.18.0.4            10.244.204.3          HTTP     150    80               0                             GET / HTTP/1.1 

Frame 4: 150 bytes on wire (1200 bits), 150 bytes captured (1200 bits)
    Encapsulation type: Ethernet (1)
    Arrival Time: May 24, 2023 08:22:03.390019000 China Standard Time
    [Time shift for this packet: 0.000000000 seconds]
    Epoch Time: 1684887723.390019000 seconds
    [Time delta from previous captured frame: 0.000057000 seconds]
    [Time delta from previous displayed frame: 0.000057000 seconds]
    [Time since reference or first frame: 0.000105000 seconds]
    Frame Number: 4
    Frame Length: 150 bytes (1200 bits)
    Capture Length: 150 bytes (1200 bits)
    [Frame is marked: False]
    [Frame is ignored: False]
    [Protocols in frame: eth:ethertype:ip:tcp:http]
    [Coloring Rule Name: HTTP]
    [Coloring Rule String: http || tcp.port == 80 || http2]
Ethernet II, Src: ee:ee:ee:ee:ee:ee (ee:ee:ee:ee:ee:ee), Dst: e6:28:50:d4:d0:25 (e6:28:50:d4:d0:25)
    Destination: e6:28:50:d4:d0:25 (e6:28:50:d4:d0:25)
        Address: e6:28:50:d4:d0:25 (e6:28:50:d4:d0:25)
        .... ..1. .... .... .... .... = LG bit: Locally administered address (this is NOT the factory default)
        .... ...0 .... .... .... .... = IG bit: Individual address (unicast)
    Source: ee:ee:ee:ee:ee:ee (ee:ee:ee:ee:ee:ee)
        Address: ee:ee:ee:ee:ee:ee (ee:ee:ee:ee:ee:ee)
        .... ..1. .... .... .... .... = LG bit: Locally administered address (this is NOT the factory default)
        .... ...0 .... .... .... .... = IG bit: Individual address (unicast)
    Type: IPv4 (0x0800)
Internet Protocol Version 4, Src: 172.18.0.4, Dst: 10.244.204.3
    0100 .... = Version: 4
    .... 0101 = Header Length: 20 bytes (5)
    Differentiated Services Field: 0x00 (DSCP: CS0, ECN: Not-ECT)
        0000 00.. = Differentiated Services Codepoint: Default (0)
        .... ..00 = Explicit Congestion Notification: Not ECN-Capable Transport (0)
    Total Length: 136
    Identification: 0xdc8a (56458)
    Flags: 0x40, Don't fragment
        0... .... = Reserved bit: Not set
        .1.. .... = Don't fragment: Set
        ..0. .... = More fragments: Not set
    ...0 0000 0000 0000 = Fragment Offset: 0
    Time to Live: 63
    Protocol: TCP (6)
    Header Checksum: 0xdbd7 [validation disabled]
    [Header checksum status: Unverified]
    Source Address: 172.18.0.4
    Destination Address: 10.244.204.3
Transmission Control Protocol, Src Port: 59636, Dst Port: 80, Seq: 1, Ack: 1, Len: 84
    Source Port: 59636
    Destination Port: 80
    [Stream index: 0]
    [Conversation completeness: Complete, WITH_DATA (31)]
    [TCP Segment Len: 84]
    Sequence Number: 1    (relative sequence number)
    Sequence Number (raw): 257479741
    [Next Sequence Number: 85    (relative sequence number)]
    Acknowledgment Number: 1    (relative ack number)
    Acknowledgment number (raw): 967943452
    1000 .... = Header Length: 32 bytes (8)
    Flags: 0x018 (PSH, ACK)
        000. .... .... = Reserved: Not set
        ...0 .... .... = Nonce: Not set
        .... 0... .... = Congestion Window Reduced (CWR): Not set
        .... .0.. .... = ECN-Echo: Not set
        .... ..0. .... = Urgent: Not set
        .... ...1 .... = Acknowledgment: Set
        .... .... 1... = Push: Set
        .... .... .0.. = Reset: Not set
        .... .... ..0. = Syn: Not set
        .... .... ...0 = Fin: Not set
        [TCP Flags: ·······AP···]
    Window: 502
    [Calculated window size: 64256]
    [Window size scaling factor: 128]
    Checksum: 0x8388 [unverified]
    [Checksum Status: Unverified]
    Urgent Pointer: 0
    Options: (12 bytes), No-Operation (NOP), No-Operation (NOP), Timestamps
        TCP Option - No-Operation (NOP)
            Kind: No-Operation (1)
        TCP Option - No-Operation (NOP)
            Kind: No-Operation (1)
        TCP Option - Timestamps: TSval 2528153793, TSecr 2685176034
            Kind: Time Stamp Option (8)
            Length: 10
            Timestamp value: 2528153793
            Timestamp echo reply: 2685176034
    [Timestamps]
        [Time since first frame in this TCP stream: 0.000105000 seconds]
        [Time since previous frame in this TCP stream: 0.000057000 seconds]
    [SEQ/ACK analysis]
        [iRTT: 0.000048000 seconds]
        [Bytes in flight: 84]
        [Bytes sent since last PSH flag: 84]
    TCP payload (84 bytes)
Hypertext Transfer Protocol
    GET / HTTP/1.1\r\n
        [Expert Info (Chat/Sequence): GET / HTTP/1.1\r\n]
            [GET / HTTP/1.1\r\n]
            [Severity level: Chat]
            [Group: Sequence]
        Request Method: GET
        Request URI: /
        Request Version: HTTP/1.1
    Host: http-example.foo.com\r\n
    User-Agent: curl/7.81.0\r\n
    Accept: */*\r\n
    \r\n
    [Full request URI: http://http-example.foo.com/]
    [HTTP request 1/1]
    [Response in frame: 17]

No.     Time                          Source                Destination           Protocol Length Destination Port Stream index Destination Port Info
      5 2023-05-24 08:22:03.390022    10.244.204.3          172.18.0.4            TCP      66     59636            0                             80 → 59636 [ACK] Seq=1 Ack=85 Win=64256 Len=0 TSval=2685176034 TSecr=2528153793

Frame 5: 66 bytes on wire (528 bits), 66 bytes captured (528 bits)
    Encapsulation type: Ethernet (1)
    Arrival Time: May 24, 2023 08:22:03.390022000 China Standard Time
    [Time shift for this packet: 0.000000000 seconds]
    Epoch Time: 1684887723.390022000 seconds
    [Time delta from previous captured frame: 0.000003000 seconds]
    [Time delta from previous displayed frame: 0.000003000 seconds]
    [Time since reference or first frame: 0.000108000 seconds]
    Frame Number: 5
    Frame Length: 66 bytes (528 bits)
    Capture Length: 66 bytes (528 bits)
    [Frame is marked: False]
    [Frame is ignored: False]
    [Protocols in frame: eth:ethertype:ip:tcp]
    [Coloring Rule Name: HTTP]
    [Coloring Rule String: http || tcp.port == 80 || http2]
Ethernet II, Src: e6:28:50:d4:d0:25 (e6:28:50:d4:d0:25), Dst: ee:ee:ee:ee:ee:ee (ee:ee:ee:ee:ee:ee)
    Destination: ee:ee:ee:ee:ee:ee (ee:ee:ee:ee:ee:ee)
        Address: ee:ee:ee:ee:ee:ee (ee:ee:ee:ee:ee:ee)
        .... ..1. .... .... .... .... = LG bit: Locally administered address (this is NOT the factory default)
        .... ...0 .... .... .... .... = IG bit: Individual address (unicast)
    Source: e6:28:50:d4:d0:25 (e6:28:50:d4:d0:25)
        Address: e6:28:50:d4:d0:25 (e6:28:50:d4:d0:25)
        .... ..1. .... .... .... .... = LG bit: Locally administered address (this is NOT the factory default)
        .... ...0 .... .... .... .... = IG bit: Individual address (unicast)
    Type: IPv4 (0x0800)
Internet Protocol Version 4, Src: 10.244.204.3, Dst: 172.18.0.4
    0100 .... = Version: 4
    .... 0101 = Header Length: 20 bytes (5)
    Differentiated Services Field: 0x00 (DSCP: CS0, ECN: Not-ECT)
        0000 00.. = Differentiated Services Codepoint: Default (0)
        .... ..00 = Explicit Congestion Notification: Not ECN-Capable Transport (0)
    Total Length: 52
    Identification: 0x5871 (22641)
    Flags: 0x40, Don't fragment
        0... .... = Reserved bit: Not set
        .1.. .... = Don't fragment: Set
        ..0. .... = More fragments: Not set
    ...0 0000 0000 0000 = Fragment Offset: 0
    Time to Live: 64
    Protocol: TCP (6)
    Header Checksum: 0x5f45 [validation disabled]
    [Header checksum status: Unverified]
    Source Address: 10.244.204.3
    Destination Address: 172.18.0.4
Transmission Control Protocol, Src Port: 80, Dst Port: 59636, Seq: 1, Ack: 85, Len: 0
    Source Port: 80
    Destination Port: 59636
    [Stream index: 0]
    [Conversation completeness: Complete, WITH_DATA (31)]
    [TCP Segment Len: 0]
    Sequence Number: 1    (relative sequence number)
    Sequence Number (raw): 967943452
    [Next Sequence Number: 1    (relative sequence number)]
    Acknowledgment Number: 85    (relative ack number)
    Acknowledgment number (raw): 257479825
    1000 .... = Header Length: 32 bytes (8)
    Flags: 0x010 (ACK)
        000. .... .... = Reserved: Not set
        ...0 .... .... = Nonce: Not set
        .... 0... .... = Congestion Window Reduced (CWR): Not set
        .... .0.. .... = ECN-Echo: Not set
        .... ..0. .... = Urgent: Not set
        .... ...1 .... = Acknowledgment: Set
        .... .... 0... = Push: Not set
        .... .... .0.. = Reset: Not set
        .... .... ..0. = Syn: Not set
        .... .... ...0 = Fin: Not set
        [TCP Flags: ·······A····]
    Window: 502
    [Calculated window size: 64256]
    [Window size scaling factor: 128]
    Checksum: 0x8334 [unverified]
    [Checksum Status: Unverified]
    Urgent Pointer: 0
    Options: (12 bytes), No-Operation (NOP), No-Operation (NOP), Timestamps
        TCP Option - No-Operation (NOP)
            Kind: No-Operation (1)
        TCP Option - No-Operation (NOP)
            Kind: No-Operation (1)
        TCP Option - Timestamps: TSval 2685176034, TSecr 2528153793
            Kind: Time Stamp Option (8)
            Length: 10
            Timestamp value: 2685176034
            Timestamp echo reply: 2528153793
    [Timestamps]
        [Time since first frame in this TCP stream: 0.000108000 seconds]
        [Time since previous frame in this TCP stream: 0.000003000 seconds]
    [SEQ/ACK analysis]
        [This is an ACK to the segment in frame: 4]
        [The RTT to ACK the segment was: 0.000003000 seconds]
        [iRTT: 0.000048000 seconds]

No.     Time                          Source                Destination           Protocol Length Destination Port Stream index Destination Port Info
      6 2023-05-24 08:22:03.390459    10.244.204.3          10.244.43.69          TCP      74     80               1                             59046 → 80 [SYN] Seq=0 Win=64860 Len=0 MSS=1410 SACK_PERM=1 TSval=595072079 TSecr=0 WS=128

Frame 6: 74 bytes on wire (592 bits), 74 bytes captured (592 bits)
    Encapsulation type: Ethernet (1)
    Arrival Time: May 24, 2023 08:22:03.390459000 China Standard Time
    [Time shift for this packet: 0.000000000 seconds]
    Epoch Time: 1684887723.390459000 seconds
    [Time delta from previous captured frame: 0.000437000 seconds]
    [Time delta from previous displayed frame: 0.000437000 seconds]
    [Time since reference or first frame: 0.000545000 seconds]
    Frame Number: 6
    Frame Length: 74 bytes (592 bits)
    Capture Length: 74 bytes (592 bits)
    [Frame is marked: False]
    [Frame is ignored: False]
    [Protocols in frame: eth:ethertype:ip:tcp]
    [Coloring Rule Name: HTTP]
    [Coloring Rule String: http || tcp.port == 80 || http2]
Ethernet II, Src: e6:28:50:d4:d0:25 (e6:28:50:d4:d0:25), Dst: ee:ee:ee:ee:ee:ee (ee:ee:ee:ee:ee:ee)
    Destination: ee:ee:ee:ee:ee:ee (ee:ee:ee:ee:ee:ee)
        Address: ee:ee:ee:ee:ee:ee (ee:ee:ee:ee:ee:ee)
        .... ..1. .... .... .... .... = LG bit: Locally administered address (this is NOT the factory default)
        .... ...0 .... .... .... .... = IG bit: Individual address (unicast)
    Source: e6:28:50:d4:d0:25 (e6:28:50:d4:d0:25)
        Address: e6:28:50:d4:d0:25 (e6:28:50:d4:d0:25)
        .... ..1. .... .... .... .... = LG bit: Locally administered address (this is NOT the factory default)
        .... ...0 .... .... .... .... = IG bit: Individual address (unicast)
    Type: IPv4 (0x0800)
Internet Protocol Version 4, Src: 10.244.204.3, Dst: 10.244.43.69
    0100 .... = Version: 4
    .... 0101 = Header Length: 20 bytes (5)
    Differentiated Services Field: 0x00 (DSCP: CS0, ECN: Not-ECT)
        0000 00.. = Differentiated Services Codepoint: Default (0)
        .... ..00 = Explicit Congestion Notification: Not ECN-Capable Transport (0)
    Total Length: 60
    Identification: 0x86d6 (34518)
    Flags: 0x40, Don't fragment
        0... .... = Reserved bit: Not set
        .1.. .... = Don't fragment: Set
        ..0. .... = More fragments: Not set
    ...0 0000 0000 0000 = Fragment Offset: 0
    Time to Live: 64
    Protocol: TCP (6)
    Header Checksum: 0xa6b5 [validation disabled]
    [Header checksum status: Unverified]
    Source Address: 10.244.204.3
    Destination Address: 10.244.43.69
Transmission Control Protocol, Src Port: 59046, Dst Port: 80, Seq: 0, Len: 0
    Source Port: 59046
    Destination Port: 80
    [Stream index: 1]
    [Conversation completeness: Incomplete, DATA (15)]
    [TCP Segment Len: 0]
    Sequence Number: 0    (relative sequence number)
    Sequence Number (raw): 1982285014
    [Next Sequence Number: 1    (relative sequence number)]
    Acknowledgment Number: 0
    Acknowledgment number (raw): 0
    1010 .... = Header Length: 40 bytes (10)
    Flags: 0x002 (SYN)
        000. .... .... = Reserved: Not set
        ...0 .... .... = Nonce: Not set
        .... 0... .... = Congestion Window Reduced (CWR): Not set
        .... .0.. .... = ECN-Echo: Not set
        .... ..0. .... = Urgent: Not set
        .... ...0 .... = Acknowledgment: Not set
        .... .... 0... = Push: Not set
        .... .... .0.. = Reset: Not set
        .... .... ..1. = Syn: Set
            [Expert Info (Chat/Sequence): Connection establish request (SYN): server port 80]
                [Connection establish request (SYN): server port 80]
                [Severity level: Chat]
                [Group: Sequence]
        .... .... ...0 = Fin: Not set
        [TCP Flags: ··········S·]
    Window: 64860
    [Calculated window size: 64860]
    Checksum: 0x0d5f [unverified]
    [Checksum Status: Unverified]
    Urgent Pointer: 0
    Options: (20 bytes), Maximum segment size, SACK permitted, Timestamps, No-Operation (NOP), Window scale
        TCP Option - Maximum segment size: 1410 bytes
            Kind: Maximum Segment Size (2)
            Length: 4
            MSS Value: 1410
        TCP Option - SACK permitted
            Kind: SACK Permitted (4)
            Length: 2
        TCP Option - Timestamps: TSval 595072079, TSecr 0
            Kind: Time Stamp Option (8)
            Length: 10
            Timestamp value: 595072079
            Timestamp echo reply: 0
        TCP Option - No-Operation (NOP)
            Kind: No-Operation (1)
        TCP Option - Window scale: 7 (multiply by 128)
            Kind: Window Scale (3)
            Length: 3
            Shift count: 7
            [Multiplier: 128]
    [Timestamps]
        [Time since first frame in this TCP stream: 0.000000000 seconds]
        [Time since previous frame in this TCP stream: 0.000000000 seconds]

No.     Time                          Source                Destination           Protocol Length Destination Port Stream index Destination Port Info
      7 2023-05-24 08:22:03.390713    10.244.43.69          10.244.204.3          TCP      74     59046            1                             80 → 59046 [SYN, ACK] Seq=0 Ack=1 Win=64308 Len=0 MSS=1410 SACK_PERM=1 TSval=1279515626 TSecr=595072079 WS=128

Frame 7: 74 bytes on wire (592 bits), 74 bytes captured (592 bits)
    Encapsulation type: Ethernet (1)
    Arrival Time: May 24, 2023 08:22:03.390713000 China Standard Time
    [Time shift for this packet: 0.000000000 seconds]
    Epoch Time: 1684887723.390713000 seconds
    [Time delta from previous captured frame: 0.000254000 seconds]
    [Time delta from previous displayed frame: 0.000254000 seconds]
    [Time since reference or first frame: 0.000799000 seconds]
    Frame Number: 7
    Frame Length: 74 bytes (592 bits)
    Capture Length: 74 bytes (592 bits)
    [Frame is marked: False]
    [Frame is ignored: False]
    [Protocols in frame: eth:ethertype:ip:tcp]
    [Coloring Rule Name: HTTP]
    [Coloring Rule String: http || tcp.port == 80 || http2]
Ethernet II, Src: ee:ee:ee:ee:ee:ee (ee:ee:ee:ee:ee:ee), Dst: e6:28:50:d4:d0:25 (e6:28:50:d4:d0:25)
    Destination: e6:28:50:d4:d0:25 (e6:28:50:d4:d0:25)
        Address: e6:28:50:d4:d0:25 (e6:28:50:d4:d0:25)
        .... ..1. .... .... .... .... = LG bit: Locally administered address (this is NOT the factory default)
        .... ...0 .... .... .... .... = IG bit: Individual address (unicast)
    Source: ee:ee:ee:ee:ee:ee (ee:ee:ee:ee:ee:ee)
        Address: ee:ee:ee:ee:ee:ee (ee:ee:ee:ee:ee:ee)
        .... ..1. .... .... .... .... = LG bit: Locally administered address (this is NOT the factory default)
        .... ...0 .... .... .... .... = IG bit: Individual address (unicast)
    Type: IPv4 (0x0800)
Internet Protocol Version 4, Src: 10.244.43.69, Dst: 10.244.204.3
    0100 .... = Version: 4
    .... 0101 = Header Length: 20 bytes (5)
    Differentiated Services Field: 0x00 (DSCP: CS0, ECN: Not-ECT)
        0000 00.. = Differentiated Services Codepoint: Default (0)
        .... ..00 = Explicit Congestion Notification: Not ECN-Capable Transport (0)
    Total Length: 60
    Identification: 0x0000 (0)
    Flags: 0x40, Don't fragment
        0... .... = Reserved bit: Not set
        .1.. .... = Don't fragment: Set
        ..0. .... = More fragments: Not set
    ...0 0000 0000 0000 = Fragment Offset: 0
    Time to Live: 62
    Protocol: TCP (6)
    Header Checksum: 0x2f8c [validation disabled]
    [Header checksum status: Unverified]
    Source Address: 10.244.43.69
    Destination Address: 10.244.204.3
Transmission Control Protocol, Src Port: 80, Dst Port: 59046, Seq: 0, Ack: 1, Len: 0
    Source Port: 80
    Destination Port: 59046
    [Stream index: 1]
    [Conversation completeness: Incomplete, DATA (15)]
    [TCP Segment Len: 0]
    Sequence Number: 0    (relative sequence number)
    Sequence Number (raw): 2266744316
    [Next Sequence Number: 1    (relative sequence number)]
    Acknowledgment Number: 1    (relative ack number)
    Acknowledgment number (raw): 1982285015
    1010 .... = Header Length: 40 bytes (10)
    Flags: 0x012 (SYN, ACK)
        000. .... .... = Reserved: Not set
        ...0 .... .... = Nonce: Not set
        .... 0... .... = Congestion Window Reduced (CWR): Not set
        .... .0.. .... = ECN-Echo: Not set
        .... ..0. .... = Urgent: Not set
        .... ...1 .... = Acknowledgment: Set
        .... .... 0... = Push: Not set
        .... .... .0.. = Reset: Not set
        .... .... ..1. = Syn: Set
            [Expert Info (Chat/Sequence): Connection establish acknowledge (SYN+ACK): server port 80]
                [Connection establish acknowledge (SYN+ACK): server port 80]
                [Severity level: Chat]
                [Group: Sequence]
        .... .... ...0 = Fin: Not set
        [TCP Flags: ·······A··S·]
    Window: 64308
    [Calculated window size: 64308]
    Checksum: 0x0d5f [unverified]
    [Checksum Status: Unverified]
    Urgent Pointer: 0
    Options: (20 bytes), Maximum segment size, SACK permitted, Timestamps, No-Operation (NOP), Window scale
        TCP Option - Maximum segment size: 1410 bytes
            Kind: Maximum Segment Size (2)
            Length: 4
            MSS Value: 1410
        TCP Option - SACK permitted
            Kind: SACK Permitted (4)
            Length: 2
        TCP Option - Timestamps: TSval 1279515626, TSecr 595072079
            Kind: Time Stamp Option (8)
            Length: 10
            Timestamp value: 1279515626
            Timestamp echo reply: 595072079
        TCP Option - No-Operation (NOP)
            Kind: No-Operation (1)
        TCP Option - Window scale: 7 (multiply by 128)
            Kind: Window Scale (3)
            Length: 3
            Shift count: 7
            [Multiplier: 128]
    [Timestamps]
        [Time since first frame in this TCP stream: 0.000254000 seconds]
        [Time since previous frame in this TCP stream: 0.000254000 seconds]
    [SEQ/ACK analysis]
        [This is an ACK to the segment in frame: 6]
        [The RTT to ACK the segment was: 0.000254000 seconds]
        [iRTT: 0.000264000 seconds]

No.     Time                          Source                Destination           Protocol Length Destination Port Stream index Destination Port Info
      8 2023-05-24 08:22:03.390723    10.244.204.3          10.244.43.69          TCP      66     80               1                             59046 → 80 [ACK] Seq=1 Ack=1 Win=64896 Len=0 TSval=595072079 TSecr=1279515626

Frame 8: 66 bytes on wire (528 bits), 66 bytes captured (528 bits)
    Encapsulation type: Ethernet (1)
    Arrival Time: May 24, 2023 08:22:03.390723000 China Standard Time
    [Time shift for this packet: 0.000000000 seconds]
    Epoch Time: 1684887723.390723000 seconds
    [Time delta from previous captured frame: 0.000010000 seconds]
    [Time delta from previous displayed frame: 0.000010000 seconds]
    [Time since reference or first frame: 0.000809000 seconds]
    Frame Number: 8
    Frame Length: 66 bytes (528 bits)
    Capture Length: 66 bytes (528 bits)
    [Frame is marked: False]
    [Frame is ignored: False]
    [Protocols in frame: eth:ethertype:ip:tcp]
    [Coloring Rule Name: HTTP]
    [Coloring Rule String: http || tcp.port == 80 || http2]
Ethernet II, Src: e6:28:50:d4:d0:25 (e6:28:50:d4:d0:25), Dst: ee:ee:ee:ee:ee:ee (ee:ee:ee:ee:ee:ee)
    Destination: ee:ee:ee:ee:ee:ee (ee:ee:ee:ee:ee:ee)
        Address: ee:ee:ee:ee:ee:ee (ee:ee:ee:ee:ee:ee)
        .... ..1. .... .... .... .... = LG bit: Locally administered address (this is NOT the factory default)
        .... ...0 .... .... .... .... = IG bit: Individual address (unicast)
    Source: e6:28:50:d4:d0:25 (e6:28:50:d4:d0:25)
        Address: e6:28:50:d4:d0:25 (e6:28:50:d4:d0:25)
        .... ..1. .... .... .... .... = LG bit: Locally administered address (this is NOT the factory default)
        .... ...0 .... .... .... .... = IG bit: Individual address (unicast)
    Type: IPv4 (0x0800)
Internet Protocol Version 4, Src: 10.244.204.3, Dst: 10.244.43.69
    0100 .... = Version: 4
    .... 0101 = Header Length: 20 bytes (5)
    Differentiated Services Field: 0x00 (DSCP: CS0, ECN: Not-ECT)
        0000 00.. = Differentiated Services Codepoint: Default (0)
        .... ..00 = Explicit Congestion Notification: Not ECN-Capable Transport (0)
    Total Length: 52
    Identification: 0x86d7 (34519)
    Flags: 0x40, Don't fragment
        0... .... = Reserved bit: Not set
        .1.. .... = Don't fragment: Set
        ..0. .... = More fragments: Not set
    ...0 0000 0000 0000 = Fragment Offset: 0
    Time to Live: 64
    Protocol: TCP (6)
    Header Checksum: 0xa6bc [validation disabled]
    [Header checksum status: Unverified]
    Source Address: 10.244.204.3
    Destination Address: 10.244.43.69
Transmission Control Protocol, Src Port: 59046, Dst Port: 80, Seq: 1, Ack: 1, Len: 0
    Source Port: 59046
    Destination Port: 80
    [Stream index: 1]
    [Conversation completeness: Incomplete, DATA (15)]
    [TCP Segment Len: 0]
    Sequence Number: 1    (relative sequence number)
    Sequence Number (raw): 1982285015
    [Next Sequence Number: 1    (relative sequence number)]
    Acknowledgment Number: 1    (relative ack number)
    Acknowledgment number (raw): 2266744317
    1000 .... = Header Length: 32 bytes (8)
    Flags: 0x010 (ACK)
        000. .... .... = Reserved: Not set
        ...0 .... .... = Nonce: Not set
        .... 0... .... = Congestion Window Reduced (CWR): Not set
        .... .0.. .... = ECN-Echo: Not set
        .... ..0. .... = Urgent: Not set
        .... ...1 .... = Acknowledgment: Set
        .... .... 0... = Push: Not set
        .... .... .0.. = Reset: Not set
        .... .... ..0. = Syn: Not set
        .... .... ...0 = Fin: Not set
        [TCP Flags: ·······A····]
    Window: 507
    [Calculated window size: 64896]
    [Window size scaling factor: 128]
    Checksum: 0x0d57 [unverified]
    [Checksum Status: Unverified]
    Urgent Pointer: 0
    Options: (12 bytes), No-Operation (NOP), No-Operation (NOP), Timestamps
        TCP Option - No-Operation (NOP)
            Kind: No-Operation (1)
        TCP Option - No-Operation (NOP)
            Kind: No-Operation (1)
        TCP Option - Timestamps: TSval 595072079, TSecr 1279515626
            Kind: Time Stamp Option (8)
            Length: 10
